<!ELEMENT root (n24, n4, n11, n3, n27, n15, n1, n25, n31, n29, n18, n17, n20, n8, n5, n28, n2, n16, n10, n13, n26, n9, n12, n7, n6, n23, n14, n30, n22, n21, n19)>
<!ELEMENT n24 (acces, annee_installation, adresse_complete, adresse, horaires_normal, horaires_vacances_hiver, horaires_vacances_ete, site, xy, arrond)>
<!ATTLIST n24
          id CDATA #REQUIRED>
<!ELEMENT acces (#PCDATA)>
<!ATTLIST acces
          id CDATA #REQUIRED>
<!ELEMENT annee_installation (#PCDATA)>
<!ATTLIST annee_installation
          id CDATA #REQUIRED>
<!ELEMENT adresse_complete (#PCDATA)>
<!ATTLIST adresse_complete
          id CDATA #REQUIRED>
<!ELEMENT adresse (#PCDATA)>
<!ATTLIST adresse
          id CDATA #REQUIRED>
<!ELEMENT horaires_normal (#PCDATA)>
<!ATTLIST horaires_normal
          id CDATA #REQUIRED>
<!ELEMENT horaires_vacances_hiver (#PCDATA)>
<!ATTLIST horaires_vacances_hiver
          id CDATA #REQUIRED>
<!ELEMENT horaires_vacances_ete (#PCDATA)>
<!ATTLIST horaires_vacances_ete
          id CDATA #REQUIRED>
<!ELEMENT site (#PCDATA)>
<!ATTLIST site
          id CDATA #REQUIRED>
<!ELEMENT xy (item+)>
<!ATTLIST xy
          id CDATA #REQUIRED>
<!ELEMENT item (#PCDATA)>
<!ATTLIST item
          id CDATA #REQUIRED>
<!ELEMENT arrond (#PCDATA)>
<!ATTLIST arrond
          id CDATA #REQUIRED>
<!ELEMENT n4 (acces, annee_installation, adresse_complete, adresse, horaires_normal, horaires_vacances_hiver, horaires_vacances_ete, site, xy, arrond)>
<!ATTLIST n4
          id CDATA #REQUIRED>
<!ELEMENT n11 (acces, annee_installation, adresse_complete, adresse, horaires_normal, horaires_vacances_hiver, horaires_vacances_ete, site, xy, arrond)>
<!ATTLIST n11
          id CDATA #REQUIRED>
<!ELEMENT n3 (acces, arrond, adresse_complete, adresse, horaires_vacances_hiver, annee_installation, site, xy)>
<!ATTLIST n3
          id CDATA #REQUIRED>
<!ELEMENT n27 (acces, annee_installation, adresse_complete, adresse, horaires_normal, horaires_vacances_hiver, horaires_vacances_ete, site, xy, arrond)>
<!ATTLIST n27
          id CDATA #REQUIRED>
<!ELEMENT n15 (acces, annee_installation, adresse_complete, adresse, horaires_normal, horaires_vacances_hiver, horaires_vacances_ete, site, xy, arrond)>
<!ATTLIST n15
          id CDATA #REQUIRED>
<!ELEMENT n1 (acces, annee_installation, adresse_complete, adresse, horaires_normal, horaires_vacances_hiver, horaires_vacances_ete, site, xy, arrond)>
<!ATTLIST n1
          id CDATA #REQUIRED>
<!ELEMENT n25 (acces, annee_installation, adresse_complete, adresse, horaires_normal, horaires_vacances_hiver, horaires_vacances_ete, site, xy, arrond)>
<!ATTLIST n25
          id CDATA #REQUIRED>
<!ELEMENT n31 (acces, annee_installation, adresse_complete, adresse, horaires_normal, horaires_vacances_hiver, horaires_vacances_ete, site, xy, arrond)>
<!ATTLIST n31
          id CDATA #REQUIRED>
<!ELEMENT n29 (acces, annee_installation, adresse_complete, adresse, horaires_vacances_hiver, horaires_vacances_ete, site, xy, arrond)>
<!ATTLIST n29
          id CDATA #REQUIRED>
<!ELEMENT n18 (acces, annee_installation, adresse_complete, adresse, horaires_vacances_hiver, horaires_vacances_ete, site, xy, arrond)>
<!ATTLIST n18
          id CDATA #REQUIRED>
<!ELEMENT n17 (acces, annee_installation, adresse_complete, adresse, horaires_normal, horaires_vacances_hiver, horaires_vacances_ete, site, xy, arrond)>
<!ATTLIST n17
          id CDATA #REQUIRED>
<!ELEMENT n20 (acces, annee_installation, adresse_complete, adresse, horaires_normal, horaires_vacances_hiver, horaires_vacances_ete, site, xy, arrond)>
<!ATTLIST n20
          id CDATA #REQUIRED>
<!ELEMENT n8 (acces, annee_installation, adresse_complete, adresse, horaires_normal, horaires_vacances_hiver, horaires_vacances_ete, site, xy, arrond)>
<!ATTLIST n8
          id CDATA #REQUIRED>
<!ELEMENT n5 (acces, arrond, adresse_complete, adresse, horaires_vacances_hiver, annee_installation, site, xy)>
<!ATTLIST n5
          id CDATA #REQUIRED>
<!ELEMENT n28 (acces, annee_installation, adresse_complete, adresse, horaires_normal, horaires_vacances_hiver, horaires_vacances_ete, site, xy, arrond)>
<!ATTLIST n28
          id CDATA #REQUIRED>
<!ELEMENT n2 (acces, arrond, adresse_complete, adresse, annee_installation, site, xy)>
<!ATTLIST n2
          id CDATA #REQUIRED>
<!ELEMENT n16 (acces, annee_installation, adresse_complete, adresse, horaires_normal, horaires_vacances_hiver, horaires_vacances_ete, site, xy, arrond)>
<!ATTLIST n16
          id CDATA #REQUIRED>
<!ELEMENT n10 (acces, annee_installation, adresse_complete, adresse, horaires_normal, horaires_vacances_hiver, horaires_vacances_ete, site, xy, arrond)>
<!ATTLIST n10
          id CDATA #REQUIRED>
<!ELEMENT n13 (acces, annee_installation, adresse_complete, adresse, horaires_normal, horaires_vacances_hiver, horaires_vacances_ete, site, xy, arrond)>
<!ATTLIST n13
          id CDATA #REQUIRED>
<!ELEMENT n26 (acces, annee_installation, adresse_complete, adresse, horaires_normal, horaires_vacances_hiver, horaires_vacances_ete, site, xy, arrond)>
<!ATTLIST n26
          id CDATA #REQUIRED>
<!ELEMENT n9 (acces, annee_installation, adresse_complete, adresse, horaires_normal, horaires_vacances_hiver, horaires_vacances_ete, site, xy, arrond)>
<!ATTLIST n9
          id CDATA #REQUIRED>
<!ELEMENT n12 (acces, annee_installation, adresse_complete, adresse, horaires_normal, horaires_vacances_hiver, horaires_vacances_ete, site, xy, arrond)>
<!ATTLIST n12
          id CDATA #REQUIRED>
<!ELEMENT n7 (acces, arrond, adresse_complete, adresse, horaires_vacances_hiver, annee_installation, site, xy, horaires_normal)>
<!ATTLIST n7
          id CDATA #REQUIRED>
<!ELEMENT n6 (acces, arrond, adresse_complete, adresse, horaires_vacances_hiver, annee_installation, site, xy, horaires_normal)>
<!ATTLIST n6
          id CDATA #REQUIRED>
<!ELEMENT n23 (acces, arrond, adresse_complete, adresse, horaires_vacances_hiver, annee_installation, site, xy, horaires_normal)>
<!ATTLIST n23
          id CDATA #REQUIRED>
<!ELEMENT n14 (acces, arrond, adresse_complete, adresse, horaires_vacances_hiver, annee_installation, site, xy, horaires_normal)>
<!ATTLIST n14
          id CDATA #REQUIRED>
<!ELEMENT n30 (acces, annee_installation, adresse_complete, adresse, horaires_normal, horaires_vacances_hiver, horaires_vacances_ete, site, xy, arrond)>
<!ATTLIST n30
          id CDATA #REQUIRED>
<!ELEMENT n22 (acces, arrond, adresse_complete, adresse, annee_installation, site, xy)>
<!ATTLIST n22
          id CDATA #REQUIRED>
<!ELEMENT n21 (acces, arrond, adresse_complete, adresse, annee_installation, site, xy)>
<!ATTLIST n21
          id CDATA #REQUIRED>
<!ELEMENT n19 (acces, annee_installation, adresse_complete, adresse, horaires_normal, horaires_vacances_hiver, horaires_vacances_ete, site, xy, arrond)>
<!ATTLIST n19
          id CDATA #REQUIRED>
